{
  "$schema": "http://json-schema.org/draft-07/schema#",
  "type": "object",
  "required": ["id", "claim", "value", "unit", "source", "verified", "lastChecked"],
  "additionalProperties": false,
  "properties": {
    "id": {
      "type": "string",
      "pattern": "^[a-z0-9-]+$",
      "description": "Kebab-case slug, unique across all claims"
    },
    "claim": {
      "type": "object",
      "required": ["nl", "en"],
      "additionalProperties": false,
      "properties": {
        "nl": { "type": "string", "minLength": 10 },
        "en": { "type": "string", "minLength": 10 }
      }
    },
    "value": { "type": "number" },
    "unit": { "type": "string", "minLength": 1 },
    "source": {
      "type": "object",
      "required": ["name", "url", "accessed", "type"],
      "additionalProperties": false,
      "properties": {
        "name": { "type": "string", "minLength": 1 },
        "url": { "type": "string", "format": "uri" },
        "accessed": { "type": "string", "format": "date" },
        "type": {
          "type": "string",
          "enum": ["primary", "secondary", "model-estimate"]
        }
      }
    },
    "verified": { "type": "boolean" },
    "lastChecked": { "type": "string", "format": "date" }
  }
}
